{
  "schema": "dsh-researcher/current-release/v1",
  "published_version": "0.8.0-alpha.10",
  "published_tag": "v0.8.0-alpha.10",
  "development_version": "0.8.0-alpha.11-dev.0",
  "distribution": "github-release-and-pinned-github-source",
  "artifact_kind": "dsh-preset-bundle-and-node-governance-library"
}
